<?xml version="1.0" encoding="UTF-8"?>
<item id="MS-DAR-00114-00001" xmlns="http://cudl.lib.cam.ac.uk/1.0/item" xmlns:xsi="http://www.w3.org/2001/XMLSchema-instance" xsi:schemaLocation="http://cudl.lib.cam.ac.uk/1.0/item item.xsd">
   <flags/>
   <resources>
      <resource>
         <type>metadata</type>
         <representation>dcp</representation>
         <location>/v1/metadata/dcp/MS-DAR-00114-00001/</location>
      </resource>
      <resource>
         <type>image</type>
         <representation>jp2</representation>
         <location>MS-DAR-00114-00001-000-00001.jp2</location>
      </resource>
      <resource>
         <type>image</type>
         <representation>jp2</representation>
         <location>MS-DAR-00114-00001-000-00002.jp2</location>
      </resource>
      <resource>
         <type>image</type>
         <representation>jp2</representation>
         <location>MS-DAR-00114-00001-000-00003.jp2</location>
      </resource>
      <resource>
         <type>image</type>
         <representation>jp2</representation>
         <location>MS-DAR-00114-00001-000-00004.jp2</location>
      </resource>
      <resource>
         <type>image</type>
         <representation>jp2</representation>
         <location>MS-DAR-00114-00001-000-00005.jp2</location>
      </resource>
      <resource>
         <type>image</type>
         <representation>jp2</representation>
         <location>MS-DAR-00114-00001-000-00006.jp2</location>
      </resource>
      <resource>
         <type>image</type>
         <representation>jp2</representation>
         <location>MS-DAR-00114-00001-000-00007.jp2</location>
      </resource>
      <resource>
         <type>image</type>
         <representation>jp2</representation>
         <location>MS-DAR-00114-00001-000-00008.jp2</location>
      </resource>
   </resources>
</item>
